{
  "title": "Top 3 Note Apps for Study Groups (2026)",
  "description": "Northwind Notes, Contoso Pad and Fabrikam Journal compared for study groups on shared editing, offline use and price. Demo: all products fictional.",
  "keyword": "note apps for study groups",
  "status": "approved",
  "updated": "2026-10-13",
  "ownProduct": true,
  "featured": false,
  "type": "comparison",
  "layout": "article",
  "hub": "",
  "related": []
}
