{
  "title": "Shared Notes App for Study Groups | Northwind Notes",
  "description": "Northwind Notes gives your study group one notebook that everyone edits at the same time. Free for one user. A demo landing page: the product is fictional.",
  "keyword": "shared notes app for study groups",
  "status": "approved",
  "updated": "2026-10-13",
  "ownProduct": true,
  "featured": false,
  "type": "guide",
  "layout": "landing",
  "hub": "",
  "related": []
}
